{
  "model": "churn",
  "framework": "xgboost",
  "task": "binary_classification",
  "target_hardware": "cpu-generic",
  "base_model": {
    "path": "/Users/karthikeyan-zc034/projects/mlops-pipeline-for-model-compression-/artifacts/churn/model.pkl",
    "hash": "4c230923387ab5a1766ba829943d467c8c31cce6f10a4a14694bea64142777af",
    "size_kb": 880.6,
    "mlflow_run_id": null
  },
  "best_variant": {
    "name": "onnx_fp32",
    "kind": "onnx",
    "format": "onnx-fp32",
    "size_kb": 638.8,
    "note": "baseline (no compression)"
  },
  "deltas": {
    "size_delta_pct": -27.46,
    "latency_ms_delta": 3.127,
    "speedup_vs_native": 0.3,
    "accuracy_delta": 0.0,
    "auc_delta": 0.0,
    "f1_delta": 0.0,
    "rmse_delta": null
  },
  "variants": [
    {
      "model": "native_xgboost",
      "kind": "native",
      "latency_ms": 1.355,
      "model_size_kb": 880.6,
      "note": "uncompressed reference",
      "accuracy": 0.97,
      "f1": 0.8378,
      "auc": 0.9902,
      "speedup_vs_native": 1.0
    },
    {
      "model": "onnx_fp32",
      "kind": "onnx",
      "latency_ms": 4.482,
      "model_size_kb": 638.8,
      "note": "baseline (no compression)",
      "accuracy": 0.97,
      "f1": 0.8378,
      "auc": 0.9902,
      "speedup_vs_native": 0.3
    }
  ],
  "gate_passed": true,
  "gate_report": {
    "model": "churn",
    "baseline": "native_xgboost",
    "task": "binary_classification",
    "checks": [
      {
        "variant": "onnx_fp32",
        "latency_ms": 4.482,
        "speedup": 0.3,
        "passed": true,
        "acc_drop": 0.0,
        "auc_drop": 0.0
      }
    ],
    "passed": true
  }
}